<?xml version="1.0" encoding="UTF-8" ?>
<postList 
	xmlns="www.whilefalse.io"
	xmlns:xsi="www.whilefalse.io/XMLTest"
	xsi:schemaLocation="postSummary.xsd">
	<postSummary>
		<title>Make Your Commits Meaningful with Emojis</title>
		<date>2016-09-25</date>
		<tags>
			<tag>Code</tag>
			<tag>Humor</tag>
		</tags>
		<imagePath>../postImages/emojiSummary.PNG</imagePath>
		<summaryText>Using emojis as shorthand can save time, be informative, and still be funny.</summaryText>
		<url>EmojisCommit.php</url>
	</postSummary>
	<postSummary>
		<title>Test Post 2</title>
		<date>2016-09-09</date>
		<tags>
			<tag>Career</tag>
		</tags>
		<imagePath>../postImages/post1Summary.JPG</imagePath>
		<summaryText>p2 text</summaryText>
		<url>post2.php</url>
	</postSummary>
	<postSummary>
		<title>Test Post 3</title>
		<date>2016-09-08</date>
		<tags>
			<tag>Humor</tag>
		</tags>
		<summaryText>p3 text</summaryText>
		<url></url>
	</postSummary>
	<postSummary>
		<title>Test Post 4</title>
		<date>2016-09-08</date>
		<tags>
			<tag>Humor</tag>
		</tags>
		<summaryText>p3 text</summaryText>
		<url></url>
	</postSummary>
	<postSummary>
		<title>Test Post 5</title>
		<date>2016-09-10</date>
		<tags>
			<tag>Code</tag>
		</tags>
		<imagePath>../postImages/post1Summary.JPG</imagePath>
		<summaryText>p2 text</summaryText>
		<url></url>
	</postSummary>
	<postSummary>
		<title>Test Post 6</title>
		<date>2016-09-09</date>
		<tags>
			<tag>Career</tag>
		</tags>
		<imagePath>../postImages/post1Summary.JPG</imagePath>
		<summaryText>p2 text</summaryText>
		<url></url>
	</postSummary>
	<postSummary>
		<title>Test Post 7</title>
		<date>2016-09-08</date>
		<tags>
			<tag>Humor</tag>
		</tags>
		<summaryText>p3 text</summaryText>
		<url></url>
	</postSummary>
	<postSummary>
		<title>Test Post 8</title>
		<date>2016-09-08</date>
		<tags>
			<tag>Humor</tag>
		</tags>
		<summaryText>p3 text</summaryText>
		<url></url>
	</postSummary>
	<postSummary>
		<title>Test Post 9</title>
		<date>2016-09-10</date>
		<tags>
			<tag>Code</tag>
		</tags>
		<imagePath>../postImages/post1Summary.JPG</imagePath>
		<summaryText>p2 text</summaryText>
		<url></url>
	</postSummary>
	<postSummary>
		<title>Test Post 10</title>
		<date>2016-09-09</date>
		<tags>
			<tag>Career</tag>
		</tags>
		<imagePath>../postImages/post1Summary.JPG</imagePath>
		<summaryText>p2 text</summaryText>
		<url></url>
	</postSummary>
	<postSummary>
		<title>Test Post 11</title>
		<date>2016-09-08</date>
		<tags>
			<tag>Humor</tag>
		</tags>
		<summaryText>p3 text</summaryText>
		<url></url>
	</postSummary>
	<postSummary>
		<title>Test Post 12</title>
		<date>2016-09-08</date>
		<tags>
			<tag>Humor</tag>
		</tags>
		<summaryText>p3 text</summaryText>
		<url></url>
	</postSummary>
	<postSummary>
		<title>Test Post 13</title>
		<date>2016-09-10</date>
		<tags>
			<tag>Code</tag>
		</tags>
		<imagePath>../postImages/post1Summary.JPG</imagePath>
		<summaryText>p2 text</summaryText>
		<url></url>
	</postSummary>
	<postSummary>
		<title>Test Post 14</title>
		<date>2016-09-09</date>
		<tags>
			<tag>Career</tag>
		</tags>
		<imagePath>../postImages/post1Summary.JPG</imagePath>
		<summaryText>p2 text</summaryText>
		<url></url>
	</postSummary>
	<postSummary>
		<title>Test Post 15</title>
		<date>2016-09-08</date>
		<tags>
			<tag>Humor</tag>
		</tags>
		<summaryText>p3 text</summaryText>
		<url></url>
	</postSummary>
	<postSummary>
		<title>Test Post 16</title>
		<date>2016-09-08</date>
		<tags>
			<tag>Humor</tag>
		</tags>
		<summaryText>p3 text</summaryText>
		<url></url>
	</postSummary>
	<postSummary>
		<title>Test Post 17</title>
		<date>2016-09-10</date>
		<tags>
			<tag>Code</tag>
		</tags>
		<imagePath>../postImages/post1Summary.JPG</imagePath>
		<summaryText>p2 text</summaryText>
		<url></url>
	</postSummary>
	<postSummary>
		<title>Test Post 18</title>
		<date>2016-09-09</date>
		<tags>
			<tag>Career</tag>
		</tags>
		<imagePath>../postImages/post1Summary.JPG</imagePath>
		<summaryText>p2 text</summaryText>
		<url></url>
	</postSummary>
	<postSummary>
		<title>Test Post 19</title>
		<date>2016-09-08</date>
		<tags>
			<tag>Humor</tag>
		</tags>
		<summaryText>p3 text</summaryText>
		<url></url>
	</postSummary>
	<postSummary>
		<title>Test Post 20</title>
		<date>2016-09-08</date>
		<tags>
			<tag>Humor</tag>
		</tags>
		<summaryText>p3 text</summaryText>
		<url></url>
	</postSummary>
</postList>